[
  {
    "schema_version": "1.0.0",
    "candidate_id": "eia:1:5c9bc5f7b5fd5d3d7f21d0b6569492a95a8cf807ecb4eaa012ea7ee32d1e75a4",
    "series_id": "INTL.44-2-ISL-QBTU.A",
    "source": "EIA",
    "route_family": "international",
    "selector": {
      "route": "/international",
      "measure": "value",
      "frequency": "annual",
      "facets": {
        "activityId": "2",
        "countryRegionId": "ISL",
        "productId": "44",
        "unit": "QBTU"
      }
    },
    "selector_source": "official_series_metadata",
    "title": "Total energy consumption, Iceland, Annual",
    "geography": {
      "name": "Iceland",
      "code": "ISL",
      "type": "other"
    },
    "concept_type": "other",
    "frequency": "annual",
    "unit": "quadrillion Btu",
    "date_start": "1980",
    "date_end": "2024",
    "is_active": true,
    "raw_metadata_reference": "https://api.eia.gov/v2/seriesid/INTL.44-2-ISL-QBTU.A",
    "metadata_hash": "6d644ec45c46ac3b4b88aac8d06811beed10023ebeed3538c43c3e913483f7b1"
  },
  {
    "schema_version": "1.0.0",
    "candidate_id": "eia:1:17de25eab289c30fe277f91d034e9b494cf6d0c9dc818fa8aa37b1566bc63d21",
    "series_id": "INTL.2-2-BRA-BKWH.A",
    "source": "EIA",
    "route_family": "international",
    "selector": {
      "route": "/international",
      "measure": "value",
      "frequency": "annual",
      "facets": {
        "activityId": "2",
        "countryRegionId": "BRA",
        "productId": "2",
        "unit": "BKWH"
      }
    },
    "selector_source": "official_series_metadata",
    "title": "Electricity net consumption, Brazil, Annual",
    "geography": {
      "name": "Brazil",
      "code": "BRA",
      "type": "other"
    },
    "concept_type": "other",
    "frequency": "annual",
    "unit": "billion kilowatthours",
    "date_start": "1980",
    "date_end": "2024",
    "is_active": true,
    "raw_metadata_reference": "https://api.eia.gov/v2/seriesid/INTL.2-2-BRA-BKWH.A",
    "metadata_hash": "88b7e77285f0e9042cc065118d55512577cbaf2210187297e62f2475f518180a"
  },
  {
    "schema_version": "1.0.0",
    "candidate_id": "eia:1:9d22f27e7bf005dc136e2188ccebcc4dedd4729d7decdcbf5a318f46f1c5d182",
    "series_id": "INTL.37-7-DNK-MK.A",
    "source": "EIA",
    "route_family": "international",
    "selector": {
      "route": "/international",
      "measure": "value",
      "frequency": "annual",
      "facets": {
        "activityId": "7",
        "countryRegionId": "DNK",
        "productId": "37",
        "unit": "MK"
      }
    },
    "selector_source": "official_series_metadata",
    "title": "Wind electricity installed capacity, Denmark, Annual",
    "geography": {
      "name": "Denmark",
      "code": "DNK",
      "type": "other"
    },
    "concept_type": "other",
    "frequency": "annual",
    "unit": "million kilowatts",
    "date_start": "1980",
    "date_end": "2024",
    "is_active": true,
    "raw_metadata_reference": "https://api.eia.gov/v2/seriesid/INTL.37-7-DNK-MK.A",
    "metadata_hash": "ae1ba0e966570651c64742f46dbc49db4ab00c3c18a90440d8c8e24c06eb4d7f"
  },
  {
    "schema_version": "1.0.0",
    "candidate_id": "eia:1:350c035f8c9048a4c79906b1a6478e94ee9212c2b727558a5eab88c12ed1aa1b",
    "series_id": "INTL.116-12-GMB-BKWH.A",
    "source": "EIA",
    "route_family": "international",
    "selector": {
      "route": "/international",
      "measure": "value",
      "frequency": "annual",
      "facets": {
        "activityId": "12",
        "countryRegionId": "GMB",
        "productId": "116",
        "unit": "BKWH"
      }
    },
    "selector_source": "official_series_metadata",
    "title": "Solar electricity net generation, Gambia, The, Annual",
    "geography": {
      "name": "The",
      "code": "GMB",
      "type": "other"
    },
    "concept_type": "other",
    "frequency": "annual",
    "unit": "billion kilowatthours",
    "date_start": "1980",
    "date_end": "2024",
    "is_active": true,
    "raw_metadata_reference": "https://api.eia.gov/v2/seriesid/INTL.116-12-GMB-BKWH.A",
    "metadata_hash": "be7b028079a4399b87189f9dcc0173b764209558c0043c73db6c8ea49d70b8ec"
  },
  {
    "schema_version": "1.0.0",
    "candidate_id": "eia:1:055b9bc51e097e84cafdcab7e5589eda02fda4bfb8a11126f0f46b561c31cd78",
    "series_id": "INTL.33-7-NOR-MK.A",
    "source": "EIA",
    "route_family": "international",
    "selector": {
      "route": "/international",
      "measure": "value",
      "frequency": "annual",
      "facets": {
        "activityId": "7",
        "countryRegionId": "NOR",
        "productId": "33",
        "unit": "MK"
      }
    },
    "selector_source": "official_series_metadata",
    "title": "Hydroelectricity installed capacity, Norway, Annual",
    "geography": {
      "name": "Norway",
      "code": "NOR",
      "type": "other"
    },
    "concept_type": "other",
    "frequency": "annual",
    "unit": "million kilowatts",
    "date_start": "1980",
    "date_end": "2024",
    "is_active": true,
    "raw_metadata_reference": "https://api.eia.gov/v2/seriesid/INTL.33-7-NOR-MK.A",
    "metadata_hash": "5cc16360013dbbe8f1f2205d5db2e82ffbd35ece2171f45f2c830b96ed3dd338"
  },
  {
    "schema_version": "1.0.0",
    "candidate_id": "eia:1:218b9e9e8b5ab80cc5fefbff9d1bf5f32ebffcd5e33e36cffe58ccbd3b42578d",
    "series_id": "INTL.27-12-FRA-BKWH.A",
    "source": "EIA",
    "route_family": "international",
    "selector": {
      "route": "/international",
      "measure": "value",
      "frequency": "annual",
      "facets": {
        "activityId": "12",
        "countryRegionId": "FRA",
        "productId": "27",
        "unit": "BKWH"
      }
    },
    "selector_source": "official_series_metadata",
    "title": "Nuclear electricity net generation, France, Annual",
    "geography": {
      "name": "France",
      "code": "FRA",
      "type": "other"
    },
    "concept_type": "other",
    "frequency": "annual",
    "unit": "billion kilowatthours",
    "date_start": "1980",
    "date_end": "2024",
    "is_active": true,
    "raw_metadata_reference": "https://api.eia.gov/v2/seriesid/INTL.27-12-FRA-BKWH.A",
    "metadata_hash": "34118055ba047b26152649c38ff8fa4068aebc53d31ea45db71ac1b548dda8fb"
  },
  {
    "schema_version": "1.0.0",
    "candidate_id": "eia:1:f54f91baf705072f6263103e2cd6b970fa1bf3e22d8eead7b6204fed3aaab947",
    "series_id": "INTL.7-4-AUS-TST.A",
    "source": "EIA",
    "route_family": "international",
    "selector": {
      "route": "/international",
      "measure": "value",
      "frequency": "annual",
      "facets": {
        "activityId": "4",
        "countryRegionId": "AUS",
        "productId": "7",
        "unit": "TST"
      }
    },
    "selector_source": "official_series_metadata",
    "title": "Coal exports, Australia, Annual",
    "geography": {
      "name": "Australia",
      "code": "AUS",
      "type": "other"
    },
    "concept_type": "other",
    "frequency": "annual",
    "unit": "thousand short tons",
    "date_start": "1980",
    "date_end": "2024",
    "is_active": true,
    "raw_metadata_reference": "https://api.eia.gov/v2/seriesid/INTL.7-4-AUS-TST.A",
    "metadata_hash": "0c48784940b672e82fc443a124db3b5fb4c02fe68cc516d6e603caafe4c61050"
  },
  {
    "schema_version": "1.0.0",
    "candidate_id": "eia:1:7c78f3d736a8e106671528e78e151e548430750c7527afaf6992f02beadbc227",
    "series_id": "INTL.7-2-CHN-TST.A",
    "source": "EIA",
    "route_family": "international",
    "selector": {
      "route": "/international",
      "measure": "value",
      "frequency": "annual",
      "facets": {
        "activityId": "2",
        "countryRegionId": "CHN",
        "productId": "7",
        "unit": "TST"
      }
    },
    "selector_source": "official_series_metadata",
    "title": "Coal consumption, China, Annual",
    "geography": {
      "name": "China",
      "code": "CHN",
      "type": "other"
    },
    "concept_type": "other",
    "frequency": "annual",
    "unit": "thousand short tons",
    "date_start": "1980",
    "date_end": "2024",
    "is_active": true,
    "raw_metadata_reference": "https://api.eia.gov/v2/seriesid/INTL.7-2-CHN-TST.A",
    "metadata_hash": "ef184d99c2a7fb9cc2ad9dd7a7c24cf1a74b570a7d0960bc4ca4fe7ce2305c33"
  },
  {
    "schema_version": "1.0.0",
    "candidate_id": "eia:1:848982c67aa2827a016d40c386277cef4bf679abc5ab793477c6de629ca2d88e",
    "series_id": "INTL.7-1-DEU-TST.A",
    "source": "EIA",
    "route_family": "international",
    "selector": {
      "route": "/international",
      "measure": "value",
      "frequency": "annual",
      "facets": {
        "activityId": "1",
        "countryRegionId": "DEU",
        "productId": "7",
        "unit": "TST"
      }
    },
    "selector_source": "official_series_metadata",
    "title": "Coal production, Germany, Annual",
    "geography": {
      "name": "Germany",
      "code": "DEU",
      "type": "other"
    },
    "concept_type": "other",
    "frequency": "annual",
    "unit": "thousand short tons",
    "date_start": "1980",
    "date_end": "2024",
    "is_active": true,
    "raw_metadata_reference": "https://api.eia.gov/v2/seriesid/INTL.7-1-DEU-TST.A",
    "metadata_hash": "2913395746555ee262275d4de0e51a46c3609c42a588793ae459f058c3a3c18f"
  },
  {
    "schema_version": "1.0.0",
    "candidate_id": "eia:1:6db4b79da53c4b133ad73d61b33d3d09b00e10985ab1573b7ad203531c183c6c",
    "series_id": "INTL.26-3-JPN-BCF.A",
    "source": "EIA",
    "route_family": "international",
    "selector": {
      "route": "/international",
      "measure": "value",
      "frequency": "annual",
      "facets": {
        "activityId": "3",
        "countryRegionId": "JPN",
        "productId": "26",
        "unit": "BCF"
      }
    },
    "selector_source": "official_series_metadata",
    "title": "Dry natural gas imports, Japan, Annual",
    "geography": {
      "name": "Japan",
      "code": "JPN",
      "type": "other"
    },
    "concept_type": "other",
    "frequency": "annual",
    "unit": "billion cubic feet",
    "date_start": "1980",